Ticket ID,Customer Name,Customer Email,Customer Age,Customer Gender,Product Purchased,Date of Purchase,Ticket Type,Ticket Subject,Ticket Description,Ticket Status,Resolution,Ticket Priority,Ticket Channel,First Response Time,Time to Resolution,Customer Satisfaction Rating
1,Marisa Obrien,marisa@example.com,32,Female,GoPro Hero,2021-03-22,Technical issue,Product setup,Having trouble setting up the camera and connecting to WiFi.,Closed,Provided step-by-step setup guide.,Low,Email,2021-03-22 12:15:36,2021-03-23 10:05:38,4
2,Jessica Rios,jessica@example.com,42,Female,LG Smart TV,2021-05-22,Technical issue,Peripheral compatibility,Remote doesn't pair; HDMI-CEC not working.,Closed,Replaced remote; updated firmware.,Medium,Chat,2021-05-22 16:45:38,2021-05-23 09:11:11,5
3,Christopher Robbins,chris@example.com,48,Male,Dell XPS,2020-07-14,Billing inquiry,Payment issue,Charged twice for the same order.,Closed,Refund processed for duplicate charge.,High,Email,2020-07-14 11:14:38,2020-07-14 18:05:38,3
4,Christina Dillon,christina@example.org,27,Female,Microsoft Office,2020-11-13,Billing inquiry,Account access,Can't sign in; password reset fails.,Pending Customer Response,,Critical,Social media,2020-11-13 07:29:40,,2
5,Alexander Carroll,alex@example.com,67,Other,Autodesk AutoCAD,2020-02-04,Refund request,Data loss,Project file corrupted after update.,Closed,Provided recovery steps and backup policy.,Low,Email,2020-02-04 00:12:42,2020-02-05 19:53:42,1
